{
  "$schema": "https://json-schema.org/draft/2020-12/schema",
  "$id": "https://github.com/hiroshitanaka-creator/Po_core_-Original-design/blob/main/schemas/semantic_jump_human_review_decision_v1.schema.json",
  "title": "Po_core semantic_jump_human_review_decision v1",
  "description": "PR-018 design + runtime contract (seed-level). Records a human review DECISION (approved / rejected / needs_revision) against a semantic_jump_human_review_request -- it never executes a semantic jump, even when the decision is 'approved'. semantic_jump_executed, semantic_frame_changed, content_rewrite_applied, state_mutation_applied, safety_bypass_applied, and trace_reset_applied are all const false: this is human-review-gate only (read / verify / record_decision / trace / validate). See docs/contracts/SEMANTIC_JUMP_HUMAN_REVIEW_GATE_V1.md.",
  "type": "object",
  "additionalProperties": false,
  "required": [
    "schema_version",
    "review_decision_id",
    "review_request_id",
    "request_id",
    "semantic_frame_proposal_id",
    "decision",
    "reviewer_type",
    "decision_reason",
    "execution_authorized",
    "semantic_jump_executed",
    "semantic_frame_changed",
    "content_rewrite_applied",
    "state_mutation_applied",
    "safety_bypass_applied",
    "trace_reset_applied",
    "requires_followup",
    "followup_recommendation",
    "created_at",
    "trace_refs"
  ],
  "properties": {
    "schema_version": { "const": "semantic_jump_human_review_decision_v1" },
    "review_decision_id": { "type": "string", "minLength": 1 },
    "review_request_id": {
      "type": "string",
      "minLength": 1,
      "description": "The semantic_jump_human_review_request.review_request_id this decision was recorded against."
    },
    "request_id": { "type": "string", "minLength": 1 },
    "semantic_frame_proposal_id": { "type": "string", "minLength": 1 },
    "decision": {
      "type": "string",
      "enum": ["approved", "rejected", "needs_revision"],
      "description": "'approved' is a human-review record for a future controlled executor -- it never executes a semantic jump in this PR. 'rejected' means this proposal does not proceed to any future execution. 'needs_revision' means the proposal must be revised or recreated before any future execution."
    },
    "reviewer_type": {
      "type": "string",
      "enum": ["human", "maintainer", "governance_reviewer", "test_fixture"],
      "description": "'test_fixture' is used by this PR's own test suite."
    },
    "decision_reason": { "type": "string", "minLength": 1 },
    "execution_authorized": {
      "type": "boolean",
      "description": "A record for a FUTURE controlled executor only. Even when true (typically alongside decision='approved'), this PR never causes actual execution -- semantic_jump_executed remains const false regardless of this value."
    },
    "semantic_jump_executed": {
      "const": false,
      "description": "This PR never executes a semantic jump, even when decision='approved' and execution_authorized=true. Always false."
    },
    "semantic_frame_changed": {
      "const": false,
      "description": "This decision never changes the semantic frame. Always false."
    },
    "content_rewrite_applied": {
      "const": false,
      "description": "This decision never rewrites content. Always false."
    },
    "state_mutation_applied": {
      "const": false,
      "description": "This decision never mutates runtime state. Always false."
    },
    "safety_bypass_applied": {
      "const": false,
      "description": "This decision never bypasses a safety gate. Always false."
    },
    "trace_reset_applied": {
      "const": false,
      "description": "This decision never resets or deletes trace. Always false."
    },
    "requires_followup": {
      "type": "boolean",
      "description": "True is recommended (not enforced by schema) when decision='needs_revision'."
    },
    "followup_recommendation": {
      "type": "string",
      "enum": [
        "none",
        "revise_proposal",
        "reject_permanently",
        "prepare_future_executor",
        "request_additional_review"
      ]
    },
    "created_at": { "type": "string", "format": "date-time" },
    "trace_refs": {
      "type": "array",
      "minItems": 1,
      "items": { "type": "string", "minLength": 1 },
      "description": "Must resolve to a SemanticJumpHumanReviewRequired event, directly or via ancestry -- enforced by TraceContinuityValidator, not expressible in JSON Schema."
    }
  }
}
