{
  "schema_version": "semantic_jump_human_review_decision_v1",
  "review_decision_id": "sjhd_reqdemo_sjhrreqde",
  "review_request_id": "sjhr_reqdemo_sfpreqde",
  "request_id": "req_demo",
  "semantic_frame_proposal_id": "sfp_reqdemo_sjpreqde",
  "decision": "approved",
  "reviewer_type": "test_fixture",
  "decision_reason": "Frame shift rationale is sound and the original semantic steps and trace are preserved; may proceed to a future controlled executor.",
  "execution_authorized": true,
  "semantic_jump_executed": false,
  "semantic_frame_changed": false,
  "content_rewrite_applied": false,
  "state_mutation_applied": false,
  "safety_bypass_applied": false,
  "trace_reset_applied": false,
  "requires_followup": false,
  "followup_recommendation": "prepare_future_executor",
  "created_at": "2026-07-08T00:05:00Z",
  "trace_refs": ["evt_semantic_jump_human_review_required_001"]
}
